{
  "name_line_1": "Jemma",
  "name_accent": "",
  "role": "Head Stylist",
  "bio": "<p>Jemma is an experienced stylist with a calm, patient approach and a particular talent for working with nervous and fearful dogs. She understands that trust cannot be rushed and uses gentle handling to help dogs feel more secure throughout their appointment.</p><p>Her specialist area is hand stripping, a precise grooming technique that requires experience, patience and close attention to coat condition. Jemma also has a strong interest in dog training. Outside the salon, she enjoys travel and the arts, and shares her home with Enzo, her Belgian Malinois.</p>",
  "portrait": {
    "id": 0,
    "url": "https://thepetstudio.local/wp-content/uploads/pet-studio/media/photos/team/jemma.jpg"
  },
  "show_signature": false,
  "reverse_columns": false
}
