{
  "name_line_1": "Bea",
  "name_accent": "",
  "role": "Apprentice",
  "bio": "<p>After completing work experience at The Pet Studio, Bea was invited to join the team as an apprentice. She is now developing her practical skills while learning from experienced groomers in a busy professional salon.</p><p>Bea loves being part of the team and values the opportunity to spend each day doing something she genuinely enjoys. She brings enthusiasm, creativity and a willingness to learn to her role. Outside work, she enjoys painting, swimming, snowboarding and spending time with her own dogs.</p>",
  "portrait": {
    "id": 0,
    "url": "https://thepetstudio.local/wp-content/uploads/pet-studio/media/photos/team/bea.jpg"
  },
  "show_signature": false,
  "reverse_columns": false
}
