{
  "name_line_1": "Rita",
  "name_accent": "",
  "role": "Receptionist",
  "bio": "<p>Rita is one of the friendly faces welcoming dogs and their owners to The Pet Studio. She enjoys getting to know customers, helping appointments run smoothly and seeing dogs leave the salon looking and feeling their best.</p><p>A lifelong dog lover, Rita previously owned and showed Golden Retrievers at championship shows. She now shares her life with Daisy, a small rescue Maltese who thoroughly enjoys being pampered. Rita’s warmth and genuine interest in every dog help make the reception experience feel personal and welcoming from the moment clients arrive.</p>",
  "portrait": {
    "id": 0,
    "url": "https://thepetstudio.local/wp-content/uploads/pet-studio/media/photos/team/rita.jpg"
  },
  "show_signature": false,
  "reverse_columns": false
}
