{
  "name_line_1": "Liz",
  "name_accent": "",
  "role": "Receptionist",
  "bio": "<p>Liz works part-time on reception, where she greets customers, manages appointments and helps keep the salon organised. She enjoys seeing the full grooming journey, from welcoming dogs through the door to the moment they are reunited with their owners after their appointment.</p><p>Her rescue dog, Lewi, has become her constant companion and occasionally joins her at work as an enthusiastic canine greeter. Liz brings kindness, reliability and a calm presence to the front of house, helping both customers and their dogs feel comfortable and looked after.</p>",
  "portrait": {
    "id": 0,
    "url": "https://thepetstudio.local/wp-content/uploads/pet-studio/media/photos/team/liz.jpg"
  },
  "show_signature": false,
  "reverse_columns": false
}
